{
  "caseSlug": "russia-ukraine",
  "chapterSlug": "road-to-invasion",
  "chapterNumber": 1,
  "title": "Road to Invasion",
  "dateRangeLabel": "Sept 2021 to 24 Feb 2022",
  "summary": "It's late 2021. Russia has gathered a huge force on three sides of Ukraine and says it's only training. Western intelligence says it's the build-up to an invasion. Read the evidence, decide what Russia is really planning, then watch what actually happens, from the first cruise missiles to the convoy that stalled outside Kyiv.",
  "estimatedMinutes": 35,
  "status": "published",
  "sourcesJsonPath": "seeds/caseFiles/russia-ukraine/road-to-invasion.sources.json",
  "stages": [
    {
      "id": "stage_co_1",
      "type": "cold_open",
      "payload": {
        "dateLabel": "28 September 2021",
        "directorBriefing": "Russia has moved a lot of soldiers and equipment close to Ukraine. We need to work out whether this is sabre-rattling or the real thing. Pin the evidence to the wall and look for patterns.",
        "backgroundPrimer": [
          {
            "label": "The setup",
            "text": "Russia and Ukraine have been on bad terms since 2014, when Russia took Crimea and started a low-level war in eastern Ukraine."
          },
          {
            "label": "What's new",
            "text": "From summer 2021, satellite photos show Russia moving huge numbers of troops and tanks into bases close to Ukraine's borders."
          },
          {
            "label": "The question",
            "text": "Is this a bluff to scare NATO into making concessions, or are they actually about to attack?"
          }
        ],
        "startingItems": [
          {
            "id": "ev_yelnya_armor",
            "title": "Hundreds of tanks parked at Yelnya",
            "thumbnailUrl": null,
            "imageCredit": "Maxar Technologies, via AP",
            "oneLineHint": "Far more tanks than a normal exercise, and 250km from the border"
          },
          {
            "id": "ev_putin_essay",
            "title": "Putin: 'Ukraine isn't a real country'",
            "thumbnailUrl": null,
            "imageCredit": "kremlin.ru, July 2021",
            "oneLineHint": "Long article saying Ukraine has no right to exist separately from Russia"
          },
          {
            "id": "ev_field_hospitals",
            "title": "Field hospitals being built near the border",
            "thumbnailUrl": null,
            "imageCredit": "OSINT analysis, Konrad Muzyka",
            "oneLineHint": "The size and number suggest preparing for real combat injuries"
          }
        ]
      },
      "scoring": {}
    },
    {
      "id": "stage_ew_1",
      "type": "evidence_wall",
      "payload": {
        "phaseLabel": "Phase 1: Sept to Dec 2021",
        "items": [
          {
            "id": "ev_yelnya_armor",
            "title": "Hundreds of tanks parked at Yelnya",
            "type": "satellite",
            "category": "Military build-up",
            "description": "Satellite photos from Maxar Technologies show roughly 800 Russian tanks and armoured vehicles parked at the Yelnya training base, around 250km north of the Ukrainian border. That is far more equipment than a normal training exercise needs.",
            "whyItMatters": "Armies don't park this much kit unless they're getting ready to actually use it.",
            "imageUrl": null,
            "imageCredit": "Maxar Technologies, via AP",
            "sourceUrl": "https://apnews.com/"
          },
          {
            "id": "ev_putin_essay",
            "title": "Putin: 'Ukraine isn't a real country'",
            "type": "transcript",
            "category": "Political signal",
            "description": "President Putin publishes a 5,000-word article on the Kremlin website arguing that Russians and Ukrainians are 'one people' and that Ukraine has no historical right to exist as a separate country.",
            "whyItMatters": "Leaders write essays like this to set up the public reasoning for what comes next, not to talk themselves out of it.",
            "imageUrl": null,
            "imageCredit": "kremlin.ru, 12 July 2021",
            "sourceUrl": "http://en.kremlin.ru/events/president/news/66181"
          },
          {
            "id": "ev_pogonovo_buildup",
            "title": "Second pile of tanks at Pogonovo",
            "type": "satellite",
            "category": "Military build-up",
            "description": "In November 2021, satellite photos show a second large concentration of tanks and vehicles at the Pogonovo training area in Russia's Voronezh region. Combined with Yelnya, that is two big bases stacked with equipment pointed at Ukraine.",
            "whyItMatters": "Two big build-ups in different places suggests Russia is preparing to attack from more than one direction at once.",
            "imageUrl": null,
            "imageCredit": "Maxar Technologies / Reuters",
            "sourceUrl": "https://www.reuters.com/"
          },
          {
            "id": "ev_field_hospitals",
            "title": "Field hospitals being built near the border",
            "type": "osint",
            "category": "Logistics",
            "description": "Open-source analysts spot newly built field-hospital sites near the Russian-Ukrainian border. Their size and number suggest they're meant for real combat casualties, not training injuries.",
            "whyItMatters": "You only build this many medical facilities when you expect a lot of wounded, meaning real fighting.",
            "imageUrl": null,
            "imageCredit": "Konrad Muzyka, Rochan Consulting",
            "sourceUrl": "https://www.rochan-consulting.com/"
          },
          {
            "id": "ev_security_demands",
            "title": "Russia's list of demands to NATO",
            "type": "document",
            "category": "Diplomatic signal",
            "description": "On 17 December 2021, Russia's Foreign Ministry publishes a draft 'Treaty on Security Guarantees', demanding NATO pulls back forces from Eastern Europe and promises never to admit Ukraine.",
            "whyItMatters": "The demands are written so NATO almost has to refuse, which then gives Russia a public 'reason' for whatever it does next.",
            "imageUrl": null,
            "imageCredit": "Russian MFA, 17 December 2021",
            "sourceUrl": "https://mid.ru/en/"
          },
          {
            "id": "ev_haines_declass",
            "title": "US warns: invasion possible by Jan or Feb",
            "type": "document",
            "category": "Intelligence warning",
            "description": "The US Director of National Intelligence and other senior US officials publicly share declassified intelligence in November 2021. They assess that Russia is preparing a multi-front invasion of Ukraine as early as January or February 2022.",
            "whyItMatters": "Governments rarely declassify intelligence. They did it here to take away Russia's element of surprise.",
            "imageUrl": null,
            "imageCredit": "US Director of National Intelligence, Nov 2021",
            "sourceUrl": "https://www.dni.gov/"
          },
          {
            "id": "ev_allied_resolve",
            "title": "Russia-Belarus joint exercise in February",
            "type": "document",
            "category": "Military build-up",
            "description": "Russia and Belarus announce a joint military exercise called 'Allied Resolve 2022' on Belarusian soil, scheduled for February 2022. The number of Russian troops involved is far larger than in previous years.",
            "whyItMatters": "An 'exercise' is the perfect cover story for moving large forces into position right next door to Ukraine.",
            "imageUrl": null,
            "imageCredit": "Belarus MoD",
            "sourceUrl": "https://www.mod.gov.by/"
          },
          {
            "id": "ev_train_movements",
            "title": "Trains full of tanks heading west",
            "type": "osint",
            "category": "Logistics",
            "description": "Open-source researchers compile dozens of TikTok videos and rail-spotter posts showing Russian tanks and supporting vehicles being moved by train towards staging areas near Ukraine.",
            "whyItMatters": "Single-direction rail flow over weeks looks like an army stockpiling for a fight, not rotating kit for an exercise.",
            "imageUrl": null,
            "imageCredit": "Konrad Muzyka, Rochan Consulting / OSINT collective",
            "sourceUrl": "https://twitter.com/konrad_muzyka"
          }
        ]
      },
      "scoring": {
        "signalWeights": {
          "ev_yelnya_armor": 0.85,
          "ev_putin_essay": 0.55,
          "ev_pogonovo_buildup": 0.80,
          "ev_field_hospitals": 0.90,
          "ev_security_demands": 0.45,
          "ev_haines_declass": 0.95,
          "ev_allied_resolve": 0.75,
          "ev_train_movements": 0.80
        },
        "validConnectionPairs": [
          ["ev_yelnya_armor", "ev_field_hospitals"],
          ["ev_field_hospitals", "ev_train_movements"],
          ["ev_putin_essay", "ev_security_demands"],
          ["ev_haines_declass", "ev_allied_resolve"],
          ["ev_yelnya_armor", "ev_train_movements"],
          ["ev_pogonovo_buildup", "ev_yelnya_armor"],
          ["ev_haines_declass", "ev_yelnya_armor"]
        ],
        "maxScore": 250
      }
    },
    {
      "id": "stage_mp_1",
      "type": "map_predictive",
      "payload": {
        "mapBounds": { "south": 43.0, "west": 22.0, "north": 56.0, "east": 42.0 },
        "hotspots": [
          { "id": "hs_yelnya",   "label": "Yelnya",         "lat": 54.58, "lng": 33.18, "kind": "staging", "tooltip": "Russian base ~250km north of Kyiv. Major tank build-up in 2021." },